{
  "id": "01K2N8Q4W5X6Y7Z8A9B0C1D2E3",
  "personne": "01K2N8Q4W5X6Y7Z8A9B0C1D2F4",
  "competence": "01K2N8Q4W5X6Y7Z8A9B0C1D2G5",
  "structure": "01K2N8Q4W5X6Y7Z8A9B0C1D2H6",
  "fiche": {
    "code": "RNCP36832",
    "rang": "C03",
    "mise_a_jour": "2025-06-12T00:00:00Z"
  },
  "periode": {
    "debut": "2025-09-01T00:00:00Z",
    "fin": "2026-06-30T00:00:00Z"
  },
  "cadre": {
    "type": "ehpad",
    "precision": "Unite protegee, equipe de jour"
  },
  "situation": {
    "texte": "Accompagnement au lever d'une personne agee en perte d'autonomie : adaptation du rythme, recherche de son accord a chaque geste, transmission ecrite a l'equipe.",
    "format": "markdown"
  },
  "declaree_le": "2026-07-02T08:15:00Z",
  "attestations": [
    {
      "statut": "en_vigueur",
      "id": "01K2N8Q4W5X6Y7Z8A9B0C1D2J7",
      "attestant": "01K2N8Q4W5X6Y7Z8A9B0C1D2K8",
      "role": "Cadre de sante, EHPAD",
      "declaration": "J'atteste avoir encadre le candidat pendant la periode declaree.",
      "attestee_le": "2026-07-05T14:00:00Z"
    },
    {
      "statut": "retiree",
      "retiree_le": "2026-07-20T09:30:00Z",
      "motif": "rgpd"
    }
  ],
  "correspondances": [
    {
      "identifiant": "01K2N8Q4W5X6Y7Z8A9B0C1D2F4",
      "type": "personne",
      "systeme": "moodle",
      "valeur": "42"
    },
    {
      "identifiant": "01K2N8Q4W5X6Y7Z8A9B0C1D2G5",
      "type": "competence",
      "systeme": "moodle",
      "valeur": "1307"
    },
    {
      "identifiant": "01K2N8Q4W5X6Y7Z8A9B0C1D2H6",
      "type": "structure",
      "systeme": "moodle",
      "valeur": "3"
    },
    {
      "identifiant": "01K2N8Q4W5X6Y7Z8A9B0C1D2K8",
      "type": "personne",
      "systeme": "moodle",
      "valeur": "17"
    }
  ]
}
