{
  "id": "01K2N8Q4W5X6Y7Z8A9B0C1D2E3",
  "personne": "01K2N8Q4W5X6Y7Z8A9B0C1D2F4",
  "competence": "01K2N8Q4W5X6Y7Z8A9B0C1D2G5",
  "fiche": {
    "code": "RS5678",
    "rang": "1",
    "mise_a_jour": "2024-01-15T00:00:00Z"
  },
  "periode": {
    "debut": "2026-03-01T00:00:00Z",
    "fin": "2026-03-01T00:00:00Z"
  },
  "cadre": {
    "type": "domicile"
  },
  "situation": {
    "texte": "Aide a la preparation du repas.",
    "format": "texte"
  },
  "declaree_le": "2026-03-02T10:00:00Z",
  "attestations": [],
  "correspondances": []
}
